{
  "$schema": "https://json-schema.org/draft/2020-12/schema",
  "title": "resume-packet.schema.json",
  "type": "object",
  "$defs": {
    "stringArray": {
      "type": "array",
      "items": {
        "type": "string",
        "minLength": 1
      }
    }
  },
  "properties": {
    "framework_version": {
      "type": "string",
      "pattern": "^\\d+\\.\\d+\\.\\d+(?:-[0-9A-Za-z.-]+)?$"
    },
    "generated_at": {
      "type": "string",
      "pattern": "^\\d{4}-\\d{2}-\\d{2}T\\d{2}:\\d{2}:\\d{2}(?:\\.\\d+)?(?:Z|[+-]\\d{2}:\\d{2})$"
    },
    "project_brief": {
      "type": "string"
    },
    "latest_session": {
      "type": "string"
    },
    "memory_sources": {
      "$ref": "#/$defs/stringArray"
    },
    "open_tasks": {
      "$ref": "#/$defs/stringArray"
    },
    "checkpoints": {
      "$ref": "#/$defs/stringArray"
    },
    "handoffs": {
      "$ref": "#/$defs/stringArray"
    },
    "workstreams": {
      "$ref": "#/$defs/stringArray"
    },
    "risks": {
      "$ref": "#/$defs/stringArray"
    },
    "next_actions": {
      "$ref": "#/$defs/stringArray"
    },
    "project_id": {
      "type": "string",
      "pattern": "^project-[a-f0-9]{32}$"
    }
  },
  "required": [
    "framework_version",
    "generated_at",
    "project_brief",
    "latest_session",
    "memory_sources",
    "open_tasks",
    "checkpoints",
    "handoffs",
    "workstreams",
    "risks",
    "next_actions"
  ],
  "additionalProperties": false
}
